<!ELEMENT MENUBAR (MENU)+>
<!ELEMENT MENU (MENU|MENU-ITEM|MENU-ITEM-CHECKBOX)+>
<!ATTLIST MENU
          name CDATA #REQUIRED>          
<!ELEMENT MENU-ITEM EMPTY>
<!ATTLIST MENU-ITEM
          name CDATA #REQUIRED
          action CDATA #IMPLIED
          image  CDATA #IMPLIED>
<!ELEMENT MENU-ITEM-CHECKBOX EMPTY>
<!ATTLIST MENU-ITEM-CHECKBOX
          name CDATA #REQUIRED
          action CDATA #IMPLIED
          image  CDATA #IMPLIED
          groupe CDATA #IMPLIED>

